codigo_fez,carater_fez,creditos_fez,codigo_obtem,carater_obtem,creditos_obtem,nome_regra,nome_fez,nome_obtem,tipo_regra
INF01032 ou QUI99009,Obrigatória,4,EmpreendimentoEletiva,Eletiva,4,INF01032=EmpreendimentoEletiva,Empreendimento em Informática ou Introdução ao Empreendedorismo e Inovação,Empreendimento em Informática,mudança de caráter
INF01124,Obrigatória,4,CPDEletiva,Eletiva,4,INF01124=CPDEletiva,Classificação e Pesquisa de Dados,Classificação e Pesquisa de Dados,mudança de caráter
INF01112,Obrigatória,4,ARQ2Eletiva,Eletiva,4,INF01112=ARQ2Eletiva,Arquitetura e Organização de Computadores II,Arquitetura e Organização de Computadores II,mudança de caráter
ECO02254,Eletiva,4,EcnA,Eletiva,4,ECO02254=EcnA,Economia A,Economia A,mapeamento direto
INF01001,Eletiva,4,EsFN,Eletiva,4,INF01001=EsFN,Especificação Formal N,Especificacao Formal N,mapeamento direto
INF01002,Eletiva,4,PrdC,Eletiva,4,INF01002=PrdC,Protocolos de Comunicação,Protocolos de Comunicacao,mapeamento direto
INF01005,Eletiva,4,CmdD,Eletiva,4,INF01005=CmdD,Comunicação de Dados,Comunicacao de Dados,mapeamento direto
INF01006,Eletiva,4,PdBdD,Eletiva,4,INF01006=PdBdD,Projeto de Banco de Dados,Projeto de Banco de Dados,mapeamento direto
INF01008,Eletiva,4,ProgPar,Obrigatória,4,INF01008=ProgPar,Programação Distribuída e Paralela,Programação Paralela,mapeamento não direto
INF01009,Eletiva,4,CmpG,Eletiva,4,INF01009=CmpG,Computação Gráfica,Computacao Grafica,mapeamento direto
INF01014,Eletiva,4,SdBdDD,Eletiva,4,INF01014=SdBdDD,Sistemas de Banco de Dados Distribuídos,Sistemas de Banco de Dados Distribuidos,mapeamento direto
INF01015,Eletiva,4,GeAeR,Eletiva,4,INF01015=GeAeR,Gerência e Aplicações em Redes,Gerencia e Aplicacoes em Redes,mapeamento direto
INF01016,Eletiva,4,GeAdP,Eletiva,4,INF01016=GeAdP,Gerência e Administração de Projetos,Gerencia e Administracao de Projetos,mapeamento direto
INF01017,Eletiva,4,ML,Obrigatória,4,INF01017=ML,Aprendizado de Máquina,Aprendizado de Máquina,mudança de caráter
INF01018,Eletiva,4,SODedR,Eletiva,4,INF01018=SODedR,Sistemas Operacionais Distribuídos e de Redes,Sistemas Operacionais Distribuidos e de Redes,mapeamento direto
INF01019,Eletiva,4,PeCG,Eletiva,4,INF01019=PeCG,Projeto em Computação Gráfica,Projeto em Computacao Grafica,mapeamento direto
INF01021,Eletiva,4,PrdH,Eletiva,4,INF01021=PrdH,Projeto de Hiperdocumentos,Projeto de Hiperdocumentos,mapeamento direto
INF01022,Eletiva,4,LdSdS,Eletiva,4,INF01022=LdSdS,Laboratório de Sistema de Software,Laboratorio de Sistema de Software,mapeamento direto
INF01023,Eletiva,4,AeDdBdD,Eletiva,4,INF01023=AeDdBdD,Arquitetura e Desempenho de Banco de Dados,Arquitetura e Desempenho de Banco de Dados,mapeamento direto
INF01030,Eletiva,4,FdVC,Eletiva,4,INF01030=FdVC,Fundamentos de Visão Computacional,Fundamentos de Visao Computacional,mapeamento direto
INF01034,Eletiva,4,RbtI,Eletiva,4,INF01034=RbtI,Robótica II,Robotica II,mapeamento direto
INF01037,Eletiva,4,CmpE,Eletiva,4,INF01037=CmpE,Computação Evolutiva,Computacao Evolutiva,mapeamento direto
INF01038,Eletiva,4,SsEN,Eletiva,4,INF01038=SsEN,Sistemas Especialistas N,Sistemas Especialistas N,mapeamento direto
INF01039,Eletiva,4,HsdC,Eletiva,4,INF01039=HsdC,História da Computação,Historia da Computacao,mapeamento direto
INF01043,Obrigatória,4,IHC,Obrigatória,4,INF01043=IHC,Interação Homem-Computador,Interação Humano-Computador e UX,mapeamento direto
INF01045,Eletiva,4,Seg,Obrigatória,4,INF01045=Seg,Segurança em Sistemas de Computação,Segurança de Sistemas e da Informação,mudança de caráter
INF01046,Obrigatória,4,PIVC,Obrigatória,4,INF01046=PIVC,Fundamentos de Processamento de Imagens,Processamento de Imagens e Visão Computacional,mapeamento não direto
INF01047,Obrigatória,4,CGVis,Obrigatória,4,INF01047=CGVis,Fundamentos de Computação Gráfica,Computação Gráfica e Visualização,mapeamento não direto
INF01048,Obrigatória,4,IA,Obrigatória,4,INF01048=IA,Inteligência Artificial,Inteligência Artificial,mapeamento direto
INF01049,Eletiva,2,IAPeI,Eletiva,2,INF01049=IAPeI,Introdução à Pesquisa em Informática,Introducao A Pesquisa em Informatica,mapeamento direto
INF01050,Eletiva,4,PLN,Obrigatória,4,INF01050=PLN,Tópicos Especiais em Engenharia de Computação I,Processamento de Linguagem Natural,mudança de caráter
INF01053,Eletiva,2,ToECPIV,Eletiva,2,INF01053=ToECPIV,Tópicos Especiais em Engenharia de Computação IV,Topicos Especiais em Engenharia de Computacao IV,mapeamento direto
INF01054,Eletiva,4,ToCICVII,Eletiva,4,INF01054=ToCICVII,Tópicos Especiais em Computação VII,Topicos Especiais em Computacao VII,mapeamento direto
INF01055,Eletiva,4,ToCICVIII,Eletiva,4,INF01055=ToCICVIII,Tópicos Especiais em Computação VIII,Topicos Especiais em Computacao VIII,mapeamento direto
INF01056,Eletiva,4,DsdP,Eletiva,4,INF01056=DsdP,Desafios de Programação,Desafios de Programacao,mapeamento direto
INF01058,Obrigatória,4,CD,Obrigatória,6,INF01058=CD,Circuitos Digitais,Circuitos Digitais,mudança no número de créditos
INF01059,Eletiva,4,SstE,Eletiva,4,INF01059=SstE,Sistemas Embarcados,Sistemas Embarcados,mapeamento direto
INF01060,Eletiva,4,ToCICXVIII,Eletiva,4,INF01060=ToCICXVIII,Tópicos Especiais em Computação XVIII,Topicos Especiais em Computacao XVIII,mapeamento direto
INF01061,Eletiva,2,ToCICXVII,Eletiva,2,INF01061=ToCICXVII,Tópicos Especiais em Computação XVII,Topicos Especiais em Computacao XVII,mapeamento direto
INF01062,Eletiva,2,ToCICXVI,Eletiva,2,INF01062=ToCICXVI,Tópicos Especiais em Computação XVI,Topicos Especiais em Computacao XVI,mapeamento direto
INF01063,Eletiva,4,ToCICXII,Eletiva,4,INF01063=ToCICXII,Tópicos Especiais em Computação XII,Topicos Especiais em Computacao XII,mapeamento direto
INF01064,Eletiva,2,ToCICXI,Eletiva,2,INF01064=ToCICXI,Tópicos Especiais em Computação XI,Topicos Especiais em Computacao XI,mapeamento direto
INF01065,Eletiva,2,ToCICX,Eletiva,2,INF01065=ToCICX,Tópicos Especiais em Computação X,Topicos Especiais em Computacao X,mapeamento direto
INF01066,Eletiva,2,ToCICXXII,Eletiva,2,INF01066=ToCICXXII,Tópicos Especiais em Computação XXII,Topicos Especiais em Computacao XXII,mapeamento direto
INF01067,Eletiva,2,ToCICXXIII,Eletiva,2,INF01067=ToCICXXIII,Tópicos Especiais em Computação XXIII,Topicos Especiais em Computacao XXIII,mapeamento direto
INF01068,Eletiva,4,ToCICXXIV,Eletiva,4,INF01068=ToCICXXIV,Tópicos Especiais em Computação XXIV,Topicos Especiais em Computacao XXIV,mapeamento direto
INF01069,Eletiva,2,ToCICXXIX,Eletiva,2,INF01069=ToCICXXIX,Tópicos Especiais em Computação XXIX,Topicos Especiais em Computacao XXIX,mapeamento direto
INF01070,Eletiva,2,ToCICXXX,Eletiva,2,INF01070=ToCICXXX,Tópicos Especiais em Computação XXX,Topicos Especiais em Computacao XXX,mapeamento direto
INF01071,Eletiva,2,ToCICXXXI,Eletiva,2,INF01071=ToCICXXXI,Tópicos Especiais em Computação XXXI,Topicos Especiais em Computacao XXXXI,mapeamento direto
INF01072,Eletiva,2,ToCICXXXII,Eletiva,2,INF01072=ToCICXXXII,Tópicos Especiais em Computação XXXII,Topicos Especiais em Computacao XXXII,mapeamento direto
INF01107,Obrigatória,4,IntroCIC,Obrigatória,4,INF01107=IntroCIC,Introdução à Arquitetura de Computadores,Introdução à Ciência da Computação,mapeamento não direto
INF01108,Obrigatória,4,Arq,Obrigatória,4,INF01108=Arq,Arquitetura e Organização de Computadores I,Arquitetura de Computadores,mapeamento não direto
INF01113,Obrigatória,4,OrgComp,Obrigatória,4,INF01113=OrgComp,Organização de Computadores B,Organização de Computadores,mapeamento direto
INF01120,Obrigatória,4,TCP,Obrigatória,4,INF01120=TCP,Técnicas de Construção de Programas,Desenvolvimento de Software de Qualidade,mapeamento não direto
INF01121,Obrigatória,4,MdLdP,Eletiva,4,INF01121=MdLdP,Modelos de Linguagem de Programação,Modelos de Linguagem de Programacao,mudança de caráter
INF01127,Obrigatória,4,ES,Obrigatória,4,INF01127=ES,Engenharia de Software N,Engenharia de Software,mapeamento direto
INF01140,Eletiva,4,CmeS,Eletiva,4,INF01140=CmeS,Computador e Sociedade,Computador e Sociedade,mapeamento direto
INF01142,Obrigatória,4,SisOp,Obrigatória,4,INF01142=SisOp,Sistemas Operacionais I N,Sistemas Operacionais,mapeamento direto
INF01145,Obrigatória,4,BD,Obrigatória,4,INF01145=BD,Fundamentos de Banco de Dados,Fundamentos de Bancos de Dados,mapeamento direto
INF01146,Eletiva,4,AvdD,Eletiva,4,INF01146=AvdD,Avaliação de Desempenho,Avaliacao de Desempenho,mapeamento direto
INF01147,Obrigatória,4,LP2,Obrigatória,4,INF01147=LP2,Compiladores,Linguagens de Programação II,mapeamento não direto
INF01151,Obrigatória,4,SDTF,Obrigatória,4,INF01151=SDTF,Sistemas Operacionais II N,Sistemas Distribuídos e Tolerantes A Falhas,mapeamento não direto
INF01154,Obrigatória,6,Redes,Obrigatória,4,INF01154=Redes,Redes de Computadores N,Redes de Computadores,mudança no número de créditos
INF01175,Eletiva,4,SDpCA,Eletiva,4,INF01175=SDpCA,Sistemas Digitais Para Computadores A,Sistemas Digitais Para Computadores A,mapeamento direto
INF01179,Eletiva,2,ToCICI,Eletiva,2,INF01179=ToCICI,Tópicos Especiais em Computação I,Topicos Especiais em Computacao I,mapeamento direto
INF01182,Eletiva,2,ToCICII,Eletiva,2,INF01182=ToCICII,Tópicos Especiais em Computação II,Topicos Especiais em Computacao II,mapeamento direto
INF01185,Eletiva,4,CdCII,Eletiva,4,INF01185=CdCII,Concepção de Circuitos Integrados I,Concepcao de Circuitos Integrados I,mapeamento direto
INF01188,Eletiva,2,ToCICIII,Eletiva,2,INF01188=ToCICIII,Tópicos Especiais em Computação III,Topicos Especiais em Computacao III,mapeamento direto
INF01191,Eletiva,4,AAdC,Eletiva,4,INF01191=AAdC,Arquiteturas Avançadas de Computadores,Arquiteturas Avancadas de Computadores,mapeamento direto
INF01198,Eletiva,2,ToCICIV,Eletiva,2,INF01198=ToCICIV,Tópicos Especiais em Computação IV,Topicos Especiais em Computacao IV,mapeamento direto
INF01202,Obrigatória,6,ALP,Obrigatória,6,INF01202=ALP,Algorítmos e Programação - CIC,Algorítmos e Programação,mapeamento direto
INF01203,Obrigatória,4,ED,Obrigatória,4,INF01203=ED,Estruturas de Dados,Estruturas de Dados,mapeamento direto
INF01205,Eletiva,4,CpSD,Eletiva,4,INF01205=CpSD,Cad Para Sistemas Digitais,Cad Para Sistemas Digitais,mapeamento direto
INF01209,Obrigatória,4,FdTAF,Eletiva,4,INF01209=FdTAF,Fundamentos de Tolerância A Falhas,Fundamentos de Tolerancia A Falhas,mudança de caráter
INF01213,Eletiva,4,FtgC,Eletiva,4,INF01213=FtgC,Fotografia Computacional,Fotografia Computacional,mapeamento direto
INF01214,Eletiva,4,TsdS,Eletiva,4,INF01214=TsdS,Teste de Software,Teste de Software,mapeamento direto
INF01215,Eletiva,4,MtdA,Eletiva,4,INF01215=MtdA,Métodos Ágeis,Metodos Ageis,mapeamento direto
INF01216,Eletiva,4,MeGdPdN,Eletiva,4,INF01216=MeGdPdN,Modelagem e Gerenciamento de Processos de Negócio,Modelagem e Gerenciamento de Processos de Negocio,mapeamento direto
INF01217,Eletiva,4,TeEdS,Eletiva,4,INF01217=TeEdS,Tendências em Engenharia de Software,Tendencias em Engenharia de Software,mapeamento direto
INF01218,Eletiva,4,ToCICXXXIII,Eletiva,4,INF01218=ToCICXXXIII,Tópicos Especiais em Computação XXXIII,Topicos Especiais em Computacao XXXIII,mapeamento direto
INF01219,Eletiva,4,PLN,Obrigatória,4,INF01219=PLN,Tópicos Especiais em Computação XXXIV,Processamento de Linguagem Natural,mudança de caráter
INF01220,Eletiva,4,ToCICXXXV,Eletiva,4,INF01220=ToCICXXXV,Tópicos Especiais em Computação XXXV,Topicos Especiais em Computacao Xxxv,mapeamento direto
INF01221,Eletiva,4,PLN,Obrigatória,4,INF01221=PLN,Tópicos Especiais em Computação XXXVI,Processamento de Linguagem Natural,mudança de caráter
INF05001,Eletiva,4,LdPeL,Eletiva,4,INF05001=LdPeL,Laboratório de Programação em Lógica,Laboratorio de Programacao em Logica,mapeamento direto
INF05003,Eletiva,4,TdCD,Eletiva,4,INF05003=TdCD,Teoria da Computação Distribuída,Teoria da Computacao Distribuida,mapeamento direto
INF05004,Eletiva,4,ML,Obrigatória,4,INF05004=ML,Inteligência Artificial Avançada,Aprendizado de Máquina,mapeamento não direto
INF05004,Eletiva,4,InAA,Eletiva,4,INF05004=InAA,Inteligência Artificial Avançada,Inteligencia Artificial Avancada,mapeamento direto
INF05005,Obrigatória,4,TeoComp1,Obrigatória,4,INF05005=TeoComp1,Linguagens Formais e Autômatos N,Teoria da Computação I - Linguagens Formais e Autômatos,mapeamento não direto
INF05006,Eletiva,4,CtCN,Eletiva,4,INF05006=CtCN,Categorias Computacionais N,Categorias Computacionais N,mapeamento direto
INF05008,Obrigatória,4,PC,Obrigatória,4,INF05008=PC,Fundamentos de Algoritmos,Pensamento Computacional,mapeamento não direto
INF05009,Eletiva,4,ToCICIX,Eletiva,4,INF05009=ToCICIX,Tópicos Especiais em Computação IX,Topicos Especiais em Computacao IX,mapeamento direto
INF05010,Obrigatória,4,PAA3,Obrigatória,4,INF05010=PAA3,Otimização Combinatória,Projeto e Análise de Algoritmos III,mapeamento não direto
INF05011,Eletiva,2,ToCICXIII,Eletiva,2,INF05011=ToCICXIII,Tópicos Especiais em Computação XIII,Topicos Especiais em Computacao XIII,mapeamento direto
INF05012,Eletiva,2,ToCICXIV,Eletiva,2,INF05012=ToCICXIV,Tópicos Especiais em Computação XIV,Topicos Especiais em Computacao XIV,mapeamento direto
INF05013,Eletiva,4,ToCICXV,Eletiva,4,INF05013=ToCICXV,Tópicos Especiais em Computação XV,Topicos Especiais em Computacao XV,mapeamento direto
INF05014,Eletiva,2,ToCICXIX,Eletiva,2,INF05014=ToCICXIX,Tópicos Especiais em Computação XIX,Topicos Especiais em Computacao XIX,mapeamento direto
INF05015,Eletiva,2,ToCICXX,Eletiva,2,INF05015=ToCICXX,Tópicos Especiais em Computação XX,Topicos Especiais em Computacao XX,mapeamento direto
INF05016,Eletiva,4,ToCICXXI,Eletiva,4,INF05016=ToCICXXI,Tópicos Especiais em Computação XXI,Topicos Especiais em Computacao XXI,mapeamento direto
INF05018,Eletiva,4,BlgC,Eletiva,4,INF05018=BlgC,Biologia Computacional,Biologia Computacional,mapeamento direto
INF05019,Eletiva,4,AAeSM,Eletiva,4,INF05019=AAeSM,Agentes Autônomos e Sistemas Multiagentes,Agentes Autonomos e Sistemas Multiagentes,mapeamento direto
INF05020,Eletiva,2,ToCICXXV,Eletiva,2,INF05020=ToCICXXV,Tópicos Especiais em Computação XXV,Topicos Especiais em Computacao XXV,mapeamento direto
INF05021,Eletiva,2,ToCICXXVI,Eletiva,2,INF05021=ToCICXXVI,Tópicos Especiais em Computação XXVI,Topicos Especiais em Computacao XXVI,mapeamento direto
INF05022,Eletiva,4,ToCICXXVII,Eletiva,4,INF05022=ToCICXXVII,Tópicos Especiais em Computação XXVII,Topicos Especiais em Computacao XXVII,mapeamento direto
INF05023,Eletiva,4,ToCICXXVIII,Eletiva,4,INF05023=ToCICXXVIII,Tópicos Especiais em Computação XXVIII,Topicos Especiais em Computacao XXVIII,mapeamento direto
INF05024,Eletiva,2,ProjCI,Obrigatória,8,INF05024=ProjCI,Tópicos Especiais em Engenharia de Computação V,Projeto em Ciência e Inovação,mudança de caráter
INF05024,Eletiva,2,ToECPV,Eletiva,2,INF05024=ToECPV,Tópicos Especiais em Engenharia de Computação V,Topicos Especiais em Engenharia de Computacao V,mapeamento direto
INF05025,Eletiva,2,ToECPVI,Eletiva,2,INF05025=ToECPVI,Tópicos Especiais em Engenharia de Computação VI,Topicos Especiais em Engenharia de Computacao VI,mapeamento direto
INF05501,Obrigatória,4,TeoComp2,Obrigatória,4,INF05501=TeoComp2,Teoria da Computação N,Teoria da Computação II - Computabilidade e Complexidade,mapeamento não direto
INF05504,Eletiva,2,ToCICV,Eletiva,2,INF05504=ToCICV,Tópicos Especiais em Computação V,Topicos Especiais em Computacao V,mapeamento direto
INF05505,Eletiva,2,ToCICVI,Eletiva,2,INF05505=ToCICVI,Tópicos Especiais em Computação VI,Topicos Especiais em Computacao VI,mapeamento direto
INF05508,Obrigatória,4,Logica,Obrigatória,4,INF05508=Logica,Lógica Para Computação,Lógica e Correção de Programas,mapeamento não direto
INF05508,Obrigatória,4,VerifTeste,Obrigatória,2,INF05508=VerifTeste,Lógica Para Computação,Verificação e Teste de Software,mapeamento não direto
INF05512,Obrigatória,4,PAA1,Obrigatória,4,INF05512=PAA1,Teoria Dos Grafos e Análise Combinatória,Projeto e Análise de Algoritmos I,mapeamento não direto
INF05515,Obrigatória,4,PAA2,Obrigatória,4,INF05515=PAA2,Complexidade de Algoritmos - B,Projeto e Análise de Algoritmos II,mapeamento não direto
INF05516,Obrigatória,4,LP1,Obrigatória,4,INF05516=LP1,Semântica Formal N,Linguagens de Programação I,mapeamento não direto
LET02720,Eletiva,4,IIpPdDI,Eletiva,4,LET02720=IIpPdDI,Inglês Instrumental Para Processamento de Dados I,Ingles Instrumental Para Processamento de Dados I,mapeamento direto
MAT01032,Obrigatória,4,CC,Obrigatória,4,MAT01032=CC,Cálculo Numérico A,Computação Científica,mapeamento não direto
MAT01353,Obrigatória,6,Calc1,Obrigatória,6,MAT01353=Calc1,Cálculo e Geometria Analítica I - A,Cálculo e Geometria Analítica I - A,mapeamento direto
MAT01354,Obrigatória,6,Calc2,Obrigatória,6,MAT01354=Calc2,Cálculo e Geometria Analítica II - A,Cálculo e Geometria Analítica II - A,mapeamento direto
MAT01355,Obrigatória,4,AlgLin,Obrigatória,4,MAT01355=AlgLin,Algebra Linear I - A,Álgebra Linear,mapeamento direto
MAT01375,Obrigatória,4,MatDisc,Obrigatória,4,MAT01375=MatDisc,Matemática Discreta B,Matemática Discreta,mapeamento direto
MAT02219,Obrigatória,4,ProbEst,Obrigatória,4,MAT02219=ProbEst,Probabilidade e Estatística,Probabilidade e Estatística,mapeamento direto
Temp-4,Eletiva,0,ProjCI,Obrigatória,8,Temp-4=ProjCI,Ingresso Até Temp-4,Projeto em Ciência e Inovação,temporalidade
Temp-5,Eletiva,0,ML,Obrigatória,4,Temp-5=ML,Ingresso Até Temp-5,Aprendizado de Máquina,temporalidade
Temp-5,Eletiva,0,ProgPar,Obrigatória,4,Temp-5=ProgPar,Ingresso Até Temp-5,Programação Paralela,temporalidade
Temp-6,Eletiva,0,Seg,Obrigatória,4,Temp-6=Seg,Ingresso Até Temp-6,Segurança de Sistemas e da Informação,temporalidade
Temp-6,Eletiva,0,PLN,Obrigatória,4,Temp-6=PLN,Ingresso Até Temp-6,Processamento de Linguagem Natural,temporalidade
Temp-7,Eletiva,0,ProjInt,Obrigatória,8,Temp-7=ProjInt,Ingresso Até Temp-7,Projeto Integrador,temporalidade
VAERE201,Eletiva,0,VAEREUm,Eletiva,0,VAERE201=VAEREUm,Vínculo Acadêmico - Ere 2020/1,Vinculo Academico - Ere 2020/1,mapeamento direto
VAERE202,Eletiva,0,VAEREDois,Eletiva,0,VAERE202=VAEREDois,Vínculo Acadêmico - Ere 2020/2,Vinculo Academico - Ere 2020/2,mapeamento direto
(INF01032 + QUI99009) + INF01022,Obrigatória e Eletiva respectivamente,4 + 4,ProjInt,Obrigatória,8,INF01032 + INF01022=ProjInt,(Empreendimento em Informática ou Introdução ao Empreendedorismo e Inovação) + Laboratório de Sistema de Software,Projeto Integrador,mudança de caráter
(INF01032 + QUI99009) + INF01019,Obrigatória e Eletiva respectivamente,4 + 4,ProjInt,Obrigatória,8,INF01032 + INF01019=ProjInt,(Empreendimento em Informática ou Introdução ao Empreendedorismo e Inovação) + Projeto em Computação Gráfica,Projeto Integrador,mudança de caráter
(INF01032 + QUI99009) + INF01006,Obrigatória e Eletiva respectivamente,4 + 4,ProjInt,Obrigatória,8,INF01032 + INF01006=ProjInt,(Empreendimento em Informática ou Introdução ao Empreendedorismo e Inovação) + Projeto de Banco de Dados,Projeto Integrador,mudança de caráter
(INF01032 + QUI99009) + INF01215,Obrigatória e Eletiva respectivamente,4 + 4,ProjInt,Obrigatória,8,INF01032 + INF01215=ProjInt,(Empreendimento em Informática ou Introdução ao Empreendedorismo e Inovação) + Métodos Ágeis,Projeto Integrador,mudança de caráter
